//UC1 creating database

mysql> CREATE DATABASE AddressBookService;
Query OK, 1 row affected (0.83 sec)

mysql> use AddressBookService;
Database changed

**************************************************

//UC2 creating address book table

mysql> create table Address_Book_Table
    -> (
    -> FirstName VARCHAR(150) NOT NULL,
    -> LastName VARCHAR(150) NOT NULL,
    -> Address VARCHAR(300) NOT NULL,
    -> City VARCHAR(100) NOT NULL,
    -> State VARCHAR(100) NOT NULL,
    -> Zip INT NOT NULL,
    -> PhoneNumber INT NOT NULL,
    -> Email VARCHAR(50) NOT NULL
    -> );
Query OK, 0 rows affected (3.21 sec)

mysql> DESCRIBE Address_Book_Table;
+-------------+--------------+------+-----+---------+-------+
| Field       | Type         | Null | Key | Default | Extra |
+-------------+--------------+------+-----+---------+-------+
| FirstName   | varchar(150) | NO   |     | NULL    |       |
| LastName    | varchar(150) | NO   |     | NULL    |       |
| Address     | varchar(300) | NO   |     | NULL    |       |
| City        | varchar(100) | NO   |     | NULL    |       |
| State       | varchar(100) | NO   |     | NULL    |       |
| Zip         | int          | NO   |     | NULL    |       |
| PhoneNumber | int          | NO   |     | NULL    |       |
| Email       | varchar(50)  | NO   |     | NULL    |       |
+-------------+--------------+------+-----+---------+-------+
8 rows in set (0.13 sec)

*******************************************************************

//UC3 Adding contacts

mysql> INSERT INTO Address_Book_Table VALUES
    -> ('Rahul', 'Ninawe', '45A, XYZ Colony','Nagpur','Maha', 879465, 21379847, 'rahul@gmail.com'),
    -> ('Ayur', 'Ninawwe', '48A, XZ Colony','Amravati','Maha', 879478,1258896, 'ayur@gmail.com'),
    -> ('Radhe', 'Kumar', '45b, XYZ Colony','Lucknow','UP', 74665, 3774814, 'radhe@gmail.com'),
    -> ('Anuj', 'Hade', '49A, XY Colony','Betul','UP', 74855, 751695, 'anuj@gmail.com');
Query OK, 4 rows affected (0.32 sec)
Records: 4  Duplicates: 0  Warnings: 0

***********************************************************

//UC4 Editing existing contact by first name

mysql> UPDATE Address_Book_Table
    -> SET Address = 'Amravati yashoda square', State ='Maharashtra', Zip = '7456', Email = 'ayurnin@gmail.com'
    -> WHERE FirstName = 'Ayur';
Query OK, 1 row affected (0.04 sec)
Rows matched: 1  Changed: 1  Warnings: 0

mysql> select * from Address_Book_Table;
+-----------+----------+-------------------------+----------+-------------+--------+-------------+-------------------+
| FirstName | LastName | Address                 | City     | State       | Zip    | PhoneNumber | Email             |
+-----------+----------+-------------------------+----------+-------------+--------+-------------+-------------------+
| Rahul     | Ninawe   | 45A, XYZ Colony         | Nagpur   | Maha        | 879465 |    21379847 | rahul@gmail.com   |
| Ayur      | Ninawwe  | Amravati yashoda square | Amravati | Maharashtra |   7456 |     1258896 | ayurnin@gmail.com |
| Radhe     | Kumar    | 45b, XYZ Colony         | Lucknow  | UP          |  74665 |     3774814 | radhe@gmail.com   |
| Anuj      | Hade     | 49A, XY Colony          | Betul    | UP          |  74855 |      751695 | anuj@gmail.com    |
+-----------+----------+-------------------------+----------+-------------+--------+-------------+-------------------+
4 rows in set (0.18 sec)

**************************************************************

//UC5 Deleting contact using first name

mysql> DELETE FROM Address_Book_Table WHERE FirstName = 'Radhe';
Query OK, 1 row affected (0.20 sec)

mysql> select * from Address_Book_Table;
+-----------+----------+-------------------------+----------+-------------+--------+-------------+-------------------+
| FirstName | LastName | Address                 | City     | State       | Zip    | PhoneNumber | Email             |
+-----------+----------+-------------------------+----------+-------------+--------+-------------+-------------------+
| Rahul     | Ninawe   | 45A, XYZ Colony         | Nagpur   | Maha        | 879465 |    21379847 | rahul@gmail.com   |
| Ayur      | Ninawwe  | Amravati yashoda square | Amravati | Maharashtra |   7456 |     1258896 | ayurnin@gmail.com |
| Anuj      | Hade     | 49A, XY Colony          | Betul    | UP          |  74855 |      751695 | anuj@gmail.com    |
+-----------+----------+-------------------------+----------+-------------+--------+-------------+-------------------+
3 rows in set (0.08 sec)

***********************************************************************

//UC6 ability to retrive person belonging to a city

mysql> SELECT * FROM Address_Book_Table WHERE City = 'Nagpur';
+-----------+----------+-----------------+--------+-------+--------+-------------+-----------------+
| FirstName | LastName | Address         | City   | State | Zip    | PhoneNumber | Email           |
+-----------+----------+-----------------+--------+-------+--------+-------------+-----------------+
| Rahul     | Ninawe   | 45A, XYZ Colony | Nagpur | Maha  | 879465 |    21379847 | rahul@gmail.com |
+-----------+----------+-----------------+--------+-------+--------+-------------+-----------------+
1 row in set (0.00 sec)

*******************************************************************

//UC7 Ability to get the size of the address book by the city

mysql> SELECT COUNT(City) FROM Address_Book_Table;
+-------------+
| COUNT(City) |
+-------------+
|           3 |
+-------------+
1 row in set (0.07 sec)

**********************************************************************

//UC8 Ability to retrieve entries in alphabetical order by First Name

mysql> select * from Address_Book_Table;
+-----------+----------+-------------------------+----------+-------+--------+-------------+-------------------+
| FirstName | LastName | Address                 | City     | State | Zip    | PhoneNumber | Email             |
+-----------+----------+-------------------------+----------+-------+--------+-------------+-------------------+
| Rahul     | Ninawe   | 45A, XYZ Colony         | Nagpur   | Maha  | 879465 |    21379847 | rahul@gmail.com   |
| Ayur      | Ninawwe  | Amravati yashoda square | Amravati | Maha  |   7456 |     1258896 | ayurnin@gmail.com |
| Anuj      | Hade     | 49A, XY Colony          | Betul    | Maha  |  74855 |      751695 | anuj@gmail.com    |
+-----------+----------+-------------------------+----------+-------+--------+-------------+-------------------+
3 rows in set (0.00 sec)

mysql> select * from Address_Book_Table WHERE State = 'Maha' ORDER BY FirstName ASC;
+-----------+----------+-------------------------+----------+-------+--------+-------------+-------------------+
| FirstName | LastName | Address                 | City     | State | Zip    | PhoneNumber | Email             |
+-----------+----------+-------------------------+----------+-------+--------+-------------+-------------------+
| Anuj      | Hade     | 49A, XY Colony          | Betul    | Maha  |  74855 |      751695 | anuj@gmail.com    |
| Ayur      | Ninawwe  | Amravati yashoda square | Amravati | Maha  |   7456 |     1258896 | ayurnin@gmail.com |
| Rahul     | Ninawe   | 45A, XYZ Colony         | Nagpur   | Maha  | 879465 |    21379847 | rahul@gmail.com   |
+-----------+----------+-------------------------+----------+-------+--------+-------------+-------------------+
3 rows in set (0.10 sec)

******************************************************************

//UC9 Ability to identify each Address Book with name and Type.

mysql> ALTER TABLE Address_Book_Table ADD Id INT NOT NULL AUTO_INCREMENT PRIMARY KEY AFTER Email;
Query OK, 0 rows affected (6.47 sec)
Records: 0  Duplicates: 0  Warnings: 0

mysql> select * from Address_Book_Table;
+-----------+----------+-------------------------+----------+-------+--------+-------------+-------------------+----+
| FirstName | LastName | Address                 | City     | State | Zip    | PhoneNumber | Email             | Id |
+-----------+----------+-------------------------+----------+-------+--------+-------------+-------------------+----+
| Rahul     | Ninawe   | 45A, XYZ Colony         | Nagpur   | Maha  | 879465 |    21379847 | rahul@gmail.com   |  1 |
| Ayur      | Ninawwe  | Amravati yashoda square | Amravati | Maha  |   7456 |     1258896 | ayurnin@gmail.com |  2 |
| Anuj      | Hade     | 49A, XY Colony          | Betul    | Maha  |  74855 |      751695 | anuj@gmail.com    |  3 |
+-----------+----------+-------------------------+----------+-------+--------+-------------+-------------------+----+
3 rows in set (0.00 sec)

mysql> ALTER TABLE Address_Book_Table ADD Type VARCHAR(50) NOT NULL AFTER Id;
Query OK, 0 rows affected (0.36 sec)
Records: 0  Duplicates: 0  Warnings: 0

mysql> UPDATE Address_Book_Table SET Type = 'Family' WHERE Id = 1;
Query OK, 1 row affected (0.14 sec)
Rows matched: 1  Changed: 1  Warnings: 0

mysql> UPDATE Address_Book_Table SET Type = 'Family' WHERE Id = 2;
Query OK, 1 row affected (0.04 sec)
Rows matched: 1  Changed: 1  Warnings: 0

mysql> UPDATE Address_Book_Table SET Type = 'Friend' WHERE Id = 3;
Query OK, 1 row affected (0.15 sec)
Rows matched: 1  Changed: 1  Warnings: 0

mysql> select * from Address_Book_Table;
+-----------+----------+-------------------------+----------+-------+--------+-------------+-------------------+----+--------+
| FirstName | LastName | Address                 | City     | State | Zip    | PhoneNumber | Email             | Id | Type   |
+-----------+----------+-------------------------+----------+-------+--------+-------------+-------------------+----+--------+
| Rahul     | Ninawe   | 45A, XYZ Colony         | Nagpur   | Maha  | 879465 |    21379847 | rahul@gmail.com   |  1 | Family |
| Ayur      | Ninawwe  | Amravati yashoda square | Amravati | Maha  |   7456 |     1258896 | ayurnin@gmail.com |  2 | Family |
| Anuj      | Hade     | 49A, XY Colony          | Betul    | Maha  |  74855 |      751695 | anuj@gmail.com    |  3 | Friend |
+-----------+----------+-------------------------+----------+-------+--------+-------------+-------------------+----+--------+
3 rows in set (0.00 sec)

mysql>  insert into Address_Book_Table (FirstName,LastName,Address,City,State,Zip,PhoneNumber,Email,Id,Type) values("Vilas","Naik","Pachgaon","Kolhapur","Maharashtra",'416500','9969999',"vikasnaik@gmail.com","4","Profession");
Query OK, 1 row affected (0.17 sec)

mysql> ALTER TABLE Address_Book_Table ADD (AddressBook VARCHAR(50) NOT NULL);
Query OK, 0 rows affected (2.15 sec)
Records: 0  Duplicates: 0  Warnings: 0

mysql> UPDATE  Address_Book_Table SET AddressBook = 'contact 1' WHERE Id = 1;
Query OK, 1 row affected (0.16 sec)
Rows matched: 1  Changed: 1  Warnings: 0

mysql> UPDATE  Address_Book_Table SET AddressBook = 'contact 2' WHERE Id = 2;
Query OK, 1 row affected (0.10 sec)
Rows matched: 1  Changed: 1  Warnings: 0

mysql> UPDATE  Address_Book_Table SET AddressBook = 'contact 3' WHERE Id = 3;
Query OK, 1 row affected (0.15 sec)
Rows matched: 1  Changed: 1  Warnings: 0

mysql> UPDATE  Address_Book_Table SET AddressBook = 'contact 4' WHERE Id = 4;
Query OK, 1 row affected (0.18 sec)
Rows matched: 1  Changed: 1  Warnings: 0

mysql> select * from Address_Book_Table;
+-----------+----------+-------------------------+----------+-------------+--------+-------------+---------------------+----+------------+-------------+
| FirstName | LastName | Address                 | City     | State       | Zip    | PhoneNumber | Email               | Id | Type       | AddressBook |
+-----------+----------+-------------------------+----------+-------------+--------+-------------+---------------------+----+------------+-------------+
| Rahul     | Ninawe   | 45A, XYZ Colony         | Nagpur   | Maha        | 879465 |    21379847 | rahul@gmail.com     |  1 | Family     | contact 1   |
| Ayur      | Ninawwe  | Amravati yashoda square | Amravati | Maha        |   7456 |     1258896 | ayurnin@gmail.com   |  2 | Family     | contact 2   |
| Anuj      | Hade     | 49A, XY Colony          | Betul    | Maha        |  74855 |      751695 | anuj@gmail.com      |  3 | Friend     | contact 3   |
| Vilas     | Naik     | Pachgaon                | Kolhapur | Maharashtra | 416500 |     9969999 | vikasnaik@gmail.com |  4 | Profession | contact 4   |
+-----------+----------+-------------------------+----------+-------------+--------+-------------+---------------------+----+------------+-------------+
4 rows in set (0.00 sec)

***********************************************************************************************************

//UC10 count by type. 

mysql> SELECT Type, COUNT(FirstName) FROM Address_Book_Table GROUP BY Type;
+------------+------------------+
| Type       | COUNT(FirstName) |
+------------+------------------+
| Family     |                2 |
| Friend     |                1 |
| Profession |                1 |
+------------+------------------+
3 rows in set (0.08 sec)

**********************************************************************************************************

//UC11 

mysql> insert into Address_Book_Table (FirstName,LastName,Address,City,State,Zip,PhoneNumber,Email,Id,type,AddressBook) values("Anuj", "Hade", "49A, XY Colony", "Betul", "Maha", '74855', '751695', "anuj@gmail.com", '5', "Family", "contact5");
Query OK, 1 row affected (0.11 sec)

mysql> select * from Address_Book_Table;
+-----------+----------+-------------------------+----------+-------------+--------+-------------+---------------------+----+------------+-------------+
| FirstName | LastName | Address                 | City     | State       | Zip    | PhoneNumber | Email               | Id | Type       | AddressBook |
+-----------+----------+-------------------------+----------+-------------+--------+-------------+---------------------+----+------------+-------------+
| Rahul     | Ninawe   | 45A, XYZ Colony         | Nagpur   | Maha        | 879465 |    21379847 | rahul@gmail.com     |  1 | Family     | contact 1   |
| Ayur      | Ninawwe  | Amravati yashoda square | Amravati | Maha        |   7456 |     1258896 | ayurnin@gmail.com   |  2 | Family     | contact 2   |
| Anuj      | Hade     | 49A, XY Colony          | Betul    | Maha        |  74855 |      751695 | anuj@gmail.com      |  3 | Friend     | contact 3   |
| Vilas     | Naik     | Pachgaon                | Kolhapur | Maharashtra | 416500 |     9969999 | vikasnaik@gmail.com |  4 | Profession | contact 4   |
| Anuj      | Hade     | 49A, XY Colony          | Betul    | Maha        |  74855 |      751695 | anuj@gmail.com      |  5 | Family     | contact 5   |
+-----------+----------+-------------------------+----------+-------------+--------+-------------+---------------------+----+------------+-------------+
5 rows in set (0.00 sec)

**************************************************************************************************************







